"product_name","product_link","category_link"
"D'Addario EXPBW023 EXP Coated 80/20 Bronze Single String, .023","https://www.ghmusic.com.au/d-addario-expbw023-exp-coated-80-20-bronze-single-string-023.html","https://www.ghmusic.com.au/guitars?limit=all"
"D'Addario EXPBW024 EXP Coated 80/20 Bronze Single String, .024","https://www.ghmusic.com.au/d-addario-expbw024-exp-coated-80-20-bronze-single-string-024.html","https://www.ghmusic.com.au/guitars?limit=all"
"D'Addario EXPBW027 EXP Coated 80/20 Bronze Single String, .027","https://www.ghmusic.com.au/d-addario-expbw027-exp-coated-80-20-bronze-single-string-027.html","https://www.ghmusic.com.au/guitars?limit=all"
"D'Addario EXPBW030 EXP Coated 80/20 Bronze Single String, .030","https://www.ghmusic.com.au/d-addario-expbw030-exp-coated-80-20-bronze-single-string-030.html","https://www.ghmusic.com.au/guitars?limit=all"
"D'Addario EXPBW036 EXP Coated 80/20 Bronze Single String, .036","https://www.ghmusic.com.au/d-addario-expbw036-exp-coated-80-20-bronze-single-string-036.html","https://www.ghmusic.com.au/guitars?limit=all"
"D'Addario EXPBW039 EXP Coated 80/20 Bronze Single String, .039","https://www.ghmusic.com.au/d-addario-expbw039-exp-coated-80-20-bronze-single-string-039.html","https://www.ghmusic.com.au/guitars?limit=all"
"D'Addario EXPBW047 EXP Coated 80/20 Bronze Single String, .047","https://www.ghmusic.com.au/d-addario-expbw047-exp-coated-80-20-bronze-single-string-047.html","https://www.ghmusic.com.au/guitars?limit=all"
"D'Addario EXPBW052 EXP Coated 80/20 Bronze Single String, .052","https://www.ghmusic.com.au/d-addario-expbw052-exp-coated-80-20-bronze-single-string-052.html","https://www.ghmusic.com.au/guitars?limit=all"
"D'Addario EXPBW059 EXP Coated 80/20 Bronze Single String, .059","https://www.ghmusic.com.au/d-addario-expbw059-exp-coated-80-20-bronze-single-string-059.html","https://www.ghmusic.com.au/guitars?limit=all"
"D'Addario EXPPB020 EXP Coated Phosphor Bronze Single String.020","https://www.ghmusic.com.au/d-addario-exppb020-exp-coated-phosphor-bronze-single-string-020.html","https://www.ghmusic.com.au/guitars?limit=all"
"D'Addario EXPPB024 EXP Coated Phosphor Bronze Single String.024","https://www.ghmusic.com.au/d-addario-exppb024-exp-coated-phosphor-bronze-single-string-024.html","https://www.ghmusic.com.au/guitars?limit=all"
"D'Addario EXPPB025 EXP Coated Phosphor Bronze Single String.025","https://www.ghmusic.com.au/d-addario-exppb025-exp-coated-phosphor-bronze-single-string-025.html","https://www.ghmusic.com.au/guitars?limit=all"
"D'Addario EXPPB028 EXP Coated Phosphor Bronze Single String.028","https://www.ghmusic.com.au/d-addario-exppb028-exp-coated-phosphor-bronze-single-string-028.html","https://www.ghmusic.com.au/guitars?limit=all"
"D'Addario EXPPB029 EXP Coated Phosphor Bronze Single String.029","https://www.ghmusic.com.au/d-addario-exppb029-exp-coated-phosphor-bronze-single-string-029.html","https://www.ghmusic.com.au/guitars?limit=all"
"D'Addario EXPPB034 EXP Coated Phosphor Bronze Single String.034","https://www.ghmusic.com.au/d-addario-exppb034-exp-coated-phosphor-bronze-single-string-034.html","https://www.ghmusic.com.au/guitars?limit=all"
"D'Addario EXPPB035 EXP Coated Phosphor Bronze Single String.035","https://www.ghmusic.com.au/d-addario-exppb035-exp-coated-phosphor-bronze-single-string-035.html","https://www.ghmusic.com.au/guitars?limit=all"
"D'Addario EXPPB042 EXP Coated Phosphor Bronze Single String.042","https://www.ghmusic.com.au/d-addario-exppb042-exp-coated-phosphor-bronze-single-string-042.html","https://www.ghmusic.com.au/guitars?limit=all"
"D'Addario EXPPB045 EXP Coated Phosphor Bronze Single String.045","https://www.ghmusic.com.au/d-addario-exppb045-exp-coated-phosphor-bronze-single-string-045.html","https://www.ghmusic.com.au/guitars?limit=all"
"D'Addario EXPPB052 EXP Coated Phosphor Bronze Single String.052","https://www.ghmusic.com.au/d-addario-exppb052-exp-coated-phosphor-bronze-single-string-052.html","https://www.ghmusic.com.au/guitars?limit=all"
"D'Addario EXPPB053 EXP Coated Phosphor Bronze Single String.053","https://www.ghmusic.com.au/d-addario-exppb053-exp-coated-phosphor-bronze-single-string-053.html","https://www.ghmusic.com.au/guitars?limit=all"
"D'Addario EXPPB060 EXP Coated Phosphor Bronze Single String.060","https://www.ghmusic.com.au/d-addario-exppb060-exp-coated-phosphor-bronze-single-string-060.html","https://www.ghmusic.com.au/guitars?limit=all"
"D'Addario EXPPB070 EXP Coated Phosphor Bronze Single String.070","https://www.ghmusic.com.au/d-addario-exppb070-exp-coated-phosphor-bronze-single-string-070.html","https://www.ghmusic.com.au/guitars?limit=all"
"D'Addario EXPXB080SL EXP Coated Nickel Round Wound Bass Guitar Single String, .080","https://www.ghmusic.com.au/d-addario-expxb080sl-exp-coated-nickel-round-wound-bass-guitar-single-string-080.html","https://www.ghmusic.com.au/guitars?limit=all"
"D'Addario EXPXB100SL EXP Coated Nickel Round Wound Bass Guitar Single String, .100","https://www.ghmusic.com.au/d-addario-expxb100sl-exp-coated-nickel-round-wound-bass-guitar-single-string-100.html","https://www.ghmusic.com.au/guitars?limit=all"
"D'Addario EZ900 85/15 Bronze Acoustic Guitar Strings, Extra Light, 10-50","https://www.ghmusic.com.au/d-addario-ez900-85-15-bronze-acoustic-guitar-strings-extra-light-10-50.html","https://www.ghmusic.com.au/guitars?limit=all"
"D'Addario EZ910 85/15 Bronze Acoustic Guitar Strings, Light, 11-52","https://www.ghmusic.com.au/d-addario-ez910-85-15-bronze-acoustic-guitar-strings-light-11-52.html","https://www.ghmusic.com.au/guitars?limit=all"
"D'Addario EZ930 85/15 12-String Bronze Acoustic Guitar Strings, Light, 10-47","https://www.ghmusic.com.au/d-addario-ez930-85-15-12-string-bronze-acoustic-guitar-strings-light-10-47.html","https://www.ghmusic.com.au/guitars?limit=all"
"D'Addario FT023 Semi-Flat Phosphor Bronze Acoustic Guitar Single String, .023","https://www.ghmusic.com.au/d-addario-ft023-semi-flat-phosphor-bronze-acoustic-guitar-single-string-023.html","https://www.ghmusic.com.au/guitars?limit=all"
"D'Addario FT028 Semi-Flat Phosphor Bronze Acoustic Guitar Single String, .028","https://www.ghmusic.com.au/d-addario-ft028-semi-flat-phosphor-bronze-acoustic-guitar-single-string-028.html","https://www.ghmusic.com.au/guitars?limit=all"
"D'Addario FT030 Semi-Flat Phosphor Bronze Acoustic Guitar Single String, .030","https://www.ghmusic.com.au/d-addario-ft030-semi-flat-phosphor-bronze-acoustic-guitar-single-string-030.html","https://www.ghmusic.com.au/guitars?limit=all"
"D'Addario FT036 Semi-Flat Phosphor Bronze Acoustic Guitar Single String, .036","https://www.ghmusic.com.au/d-addario-ft036-semi-flat-phosphor-bronze-acoustic-guitar-single-string-036.html","https://www.ghmusic.com.au/guitars?limit=all"
"D'Addario FT039 Semi-Flat Phosphor Bronze Acoustic Guitar Single String, .039","https://www.ghmusic.com.au/d-addario-ft039-semi-flat-phosphor-bronze-acoustic-guitar-single-string-039.html","https://www.ghmusic.com.au/guitars?limit=all"
"D'Addario FT045 Semi-Flat Phosphor Bronze Acoustic Guitar Single String, .045","https://www.ghmusic.com.au/d-addario-ft045-semi-flat-phosphor-bronze-acoustic-guitar-single-string-045.html","https://www.ghmusic.com.au/guitars?limit=all"
"D'Addario FT047 Semi-Flat Phosphor Bronze Acoustic Guitar Single String, .047","https://www.ghmusic.com.au/d-addario-ft047-semi-flat-phosphor-bronze-acoustic-guitar-single-string-047.html","https://www.ghmusic.com.au/guitars?limit=all"
"D'Addario J2902 Classics Rectified Classical Guitar Single String, Moderate Tension, Second String","https://www.ghmusic.com.au/d-addario-j2902-classics-rectified-classical-guitar-single-string-moderate-tension-second-string.html","https://www.ghmusic.com.au/guitars?limit=all"
"D'Addario J2903 Classics Rectified Classical Guitar Single String, Moderate Tension, Third String","https://www.ghmusic.com.au/d-addario-j2903-classics-rectified-classical-guitar-single-string-moderate-tension-third-string.html","https://www.ghmusic.com.au/guitars?limit=all"
"D'Addario J2906 Classics Rectified Classical Guitar Single String, Moderate Tension, Sixth String","https://www.ghmusic.com.au/d-addario-j2906-classics-rectified-classical-guitar-single-string-moderate-tension-sixth-string.html","https://www.ghmusic.com.au/guitars?limit=all"
"D'Addario J3001 Rectified Classical Guitar Single String, Normal Tension, First String","https://www.ghmusic.com.au/d-addario-j3001-rectified-classical-guitar-single-string-normal-tension-first-string.html","https://www.ghmusic.com.au/guitars?limit=all"
"D'Addario J3004 Rectified Classical Guitar Single String, Normal Tension, Fourth String","https://www.ghmusic.com.au/d-addario-j3004-rectified-classical-guitar-single-string-normal-tension-fourth-string.html","https://www.ghmusic.com.au/guitars?limit=all"
"D'Addario J3005 Rectified Classical Guitar Single String, Normal Tension, Fifth String","https://www.ghmusic.com.au/d-addario-j3005-rectified-classical-guitar-single-string-normal-tension-fifth-string.html","https://www.ghmusic.com.au/guitars?limit=all"
"D'Addario J4403C Pro-Arte Composite Classical Guitar Single String, Extra-Hard Tension, Third String","https://www.ghmusic.com.au/d-addario-j4403c-pro-arte-composite-classical-guitar-single-string-extra-hard-tension-third-string.html","https://www.ghmusic.com.au/guitars?limit=all"
"D'Addario J4404 Pro-Arte Nylon Classical Guitar Single String, Extra-Hard Tension, Fourth String","https://www.ghmusic.com.au/d-addario-j4404-pro-arte-nylon-classical-guitar-single-string-extra-hard-tension-fourth-string.html","https://www.ghmusic.com.au/guitars?limit=all"
"D'Addario J4501 Pro-Arte Nylon Classical Guitar Single String, Normal Tension, First String","https://www.ghmusic.com.au/d-addario-j4501-pro-arte-nylon-classical-guitar-single-string-normal-tension-first-string.html","https://www.ghmusic.com.au/guitars?limit=all"
"D'Addario J4502 Pro-Arte Nylon Classical Guitar Single String, Normal Tension, Second String","https://www.ghmusic.com.au/d-addario-j4502-pro-arte-nylon-classical-guitar-single-string-normal-tension-second-string.html","https://www.ghmusic.com.au/guitars?limit=all"
"D'Addario J4504 Pro-Arte Nylon Classical Guitar Single String, Normal Tension, Fourth String","https://www.ghmusic.com.au/d-addario-j4504-pro-arte-nylon-classical-guitar-single-string-normal-tension-fourth-string.html","https://www.ghmusic.com.au/guitars?limit=all"
"D'Addario J4504C Pro-Arte Composite Classical Guitar Single String, Normal Tension, Fourth String","https://www.ghmusic.com.au/d-addario-j4504c-pro-arte-composite-classical-guitar-single-string-normal-tension-fourth-string.html","https://www.ghmusic.com.au/guitars?limit=all"
"D'Addario J4505C Pro-Arte Composite Classical Guitar Single String, Normal Tension, Fifth String","https://www.ghmusic.com.au/d-addario-j4505c-pro-arte-composite-classical-guitar-single-string-normal-tension-fifth-string.html","https://www.ghmusic.com.au/guitars?limit=all"
"D'Addario J4505LP Pro-Arte Composite Classical Guitar Single String, Normal Tension, Fifth String","https://www.ghmusic.com.au/d-addario-j4505lp-pro-arte-composite-classical-guitar-single-string-normal-tension-fifth-string.html","https://www.ghmusic.com.au/guitars?limit=all"
"D'Addario J4505LP Pro-Arte Composite Classical Guitar Single String, Normal Tension, Sixth String","https://www.ghmusic.com.au/d-addario-j4505lp-pro-arte-composite-classical-guitar-single-string-normal-tension-sixth-string.html","https://www.ghmusic.com.au/guitars?limit=all"
"D'Addario J4601 Pro-Arte Nylon Classical Guitar Single String, Hard Tension, First String","https://www.ghmusic.com.au/d-addario-j4601-pro-arte-nylon-classical-guitar-single-string-hard-tension-first-string.html","https://www.ghmusic.com.au/guitars?limit=all"
"D'Addario J4603C Pro-Arte Nylon Classical Guitar Single String, Hard Tension, Third String","https://www.ghmusic.com.au/d-addario-j4603c-pro-arte-nylon-classical-guitar-single-string-hard-tension-third-string.html","https://www.ghmusic.com.au/guitars?limit=all"
"D'Addario J4604 Pro-Arte Nylon Classical Guitar Single String, Hard Tension, Fourth String","https://www.ghmusic.com.au/d-addario-j4604-pro-arte-nylon-classical-guitar-single-string-hard-tension-fourth-string.html","https://www.ghmusic.com.au/guitars?limit=all"
"D'Addario J4605 Pro-Arte Nylon Classical Guitar Single String, Hard Tension, Fifth String","https://www.ghmusic.com.au/d-addario-j4605-pro-arte-nylon-classical-guitar-single-string-hard-tension-fifth-string.html","https://www.ghmusic.com.au/guitars?limit=all"
"D'Addario J4605C Pro-Arte Nylon Classical Guitar Single String, Hard Tension, Fifth String","https://www.ghmusic.com.au/d-addario-j4605c-pro-arte-nylon-classical-guitar-single-string-hard-tension-fifth-string.html","https://www.ghmusic.com.au/guitars?limit=all"
"D'Addario J4606C Pro-Arte Nylon Classical Guitar Single String, Hard Tension, Sixth String","https://www.ghmusic.com.au/d-addario-j4606c-pro-arte-nylon-classical-guitar-single-string-hard-tension-sixth-string.html","https://www.ghmusic.com.au/guitars?limit=all"
"D'Addario J4606LP Pro-Arte Composite Classical Guitar Single String, Hard Tension, Sixth String","https://www.ghmusic.com.au/d-addario-j4606lp-pro-arte-composite-classical-guitar-single-string-hard-tension-sixth-string.html","https://www.ghmusic.com.au/guitars?limit=all"
"D'Addario J4706 80/20 Bronze Pro-Arte Nylon Classical Guitar Single String, Normal Tension, Sixth String","https://www.ghmusic.com.au/d-addario-j4706-80-20-bronze-pro-arte-nylon-classical-guitar-single-string-normal-tension-sixth-string.html","https://www.ghmusic.com.au/guitars?limit=all"
"D'Addario J6201 Plain Steel Mandolin Single String, .010","https://www.ghmusic.com.au/d-addario-j6201-plain-steel-mandolin-single-string-010.html","https://www.ghmusic.com.au/guitars?limit=all"
"D'Addario J6601 Plain Steel Tenor Guitar Single String, .010","https://www.ghmusic.com.au/d-addario-j6601-plain-steel-tenor-guitar-single-string-010.html","https://www.ghmusic.com.au/guitars?limit=all"
"D'Addario J6602 Plain Steel Tenor Guitar Single String, .012","https://www.ghmusic.com.au/d-addario-j6602-plain-steel-tenor-guitar-single-string-012.html","https://www.ghmusic.com.au/guitars?limit=all"
"D'Addario KPL009 Soldered Twist Reinforced Single String, .009","https://www.ghmusic.com.au/d-addario-kpl009-soldered-twist-reinforced-single-string-009.html","https://www.ghmusic.com.au/guitars?limit=all"
"D'Addario KPL010 Soldered Twist Reinforced Single String, .010","https://www.ghmusic.com.au/d-addario-kpl010-soldered-twist-reinforced-single-string-010.html","https://www.ghmusic.com.au/guitars?limit=all"
"D'Addario KPL013 Soldered Twist Reinforced Single String, .013","https://www.ghmusic.com.au/d-addario-kpl013-soldered-twist-reinforced-single-string-013.html","https://www.ghmusic.com.au/guitars?limit=all"
"D'Addario KPL014 Soldered Twist Reinforced Single String, .014","https://www.ghmusic.com.au/d-addario-kpl014-soldered-twist-reinforced-single-string-014.html","https://www.ghmusic.com.au/guitars?limit=all"
"D'Addario KPL017 Soldered Twist Reinforced Single String, .017","https://www.ghmusic.com.au/d-addario-kpl017-soldered-twist-reinforced-single-string-017.html","https://www.ghmusic.com.au/guitars?limit=all"
"D'Addario KPL020 Soldered Twist Reinforced Single String, .020","https://www.ghmusic.com.au/d-addario-kpl020-soldered-twist-reinforced-single-string-020.html","https://www.ghmusic.com.au/guitars?limit=all"
"D'Addario LE023PB Phosphor Bronze Loop End Single String, .023","https://www.ghmusic.com.au/d-addario-le023pb-phosphor-bronze-loop-end-single-string-023.html","https://www.ghmusic.com.au/guitars?limit=all"
"D'Addario LE023W Nickel Wound Loop End Single String, .023","https://www.ghmusic.com.au/d-addario-le023w-nickel-wound-loop-end-single-string-023.html","https://www.ghmusic.com.au/guitars?limit=all"
"D'Addario LE026PB Phosphor Bronze Loop End Single String, .026","https://www.ghmusic.com.au/d-addario-le026pb-phosphor-bronze-loop-end-single-string-026.html","https://www.ghmusic.com.au/guitars?limit=all"
"D'Addario LE026W Nickel Wound Loop End Single String, .026","https://www.ghmusic.com.au/d-addario-le026w-nickel-wound-loop-end-single-string-026.html","https://www.ghmusic.com.au/guitars?limit=all"
"D'Addario LE032W Nickel Wound Loop End Single String, .032","https://www.ghmusic.com.au/d-addario-le032w-nickel-wound-loop-end-single-string-032.html","https://www.ghmusic.com.au/guitars?limit=all"
"D'Addario LE034PB Phosphor Bronze Loop End Single String, .034","https://www.ghmusic.com.au/d-addario-le034pb-phosphor-bronze-loop-end-single-string-034.html","https://www.ghmusic.com.au/guitars?limit=all"
"D'Addario LE036W Nickel Wound Loop End Single String, .036","https://www.ghmusic.com.au/d-addario-le036w-nickel-wound-loop-end-single-string-036.html","https://www.ghmusic.com.au/guitars?limit=all"
"D'Addario LE038PB Phosphor Bronze Loop End Single String, .038","https://www.ghmusic.com.au/d-addario-le038pb-phosphor-bronze-loop-end-single-string-038.html","https://www.ghmusic.com.au/guitars?limit=all"
"D'Addario LE040W Nickel Wound Loop End Single String, .040","https://www.ghmusic.com.au/d-addario-le040w-nickel-wound-loop-end-single-string-040.html","https://www.ghmusic.com.au/guitars?limit=all"
"D'Addario LE042PB Phosphor Bronze Loop End Single String, .042","https://www.ghmusic.com.au/d-addario-le042pb-phosphor-bronze-loop-end-single-string-042.html","https://www.ghmusic.com.au/guitars?limit=all"
"D'Addario LE045PB Phosphor Bronze Loop End Single String, .045","https://www.ghmusic.com.au/d-addario-le045pb-phosphor-bronze-loop-end-single-string-045.html","https://www.ghmusic.com.au/guitars?limit=all"
"D'Addario LE046PB Phosphor Bronze Loop End Single String, .046","https://www.ghmusic.com.au/d-addario-le046pb-phosphor-bronze-loop-end-single-string-046.html","https://www.ghmusic.com.au/guitars?limit=all"
"D'Addario LE048W Nickel Wound Loop End Single String, .048","https://www.ghmusic.com.au/d-addario-le048w-nickel-wound-loop-end-single-string-048.html","https://www.ghmusic.com.au/guitars?limit=all"
"D'Addario LE049PB Phosphor Bronze Loop End Single String, .049","https://www.ghmusic.com.au/d-addario-le049pb-phosphor-bronze-loop-end-single-string-049.html","https://www.ghmusic.com.au/guitars?limit=all"
"D'Addario LE052W Nickel Wound Loop End Single String, .052","https://www.ghmusic.com.au/d-addario-le052w-nickel-wound-loop-end-single-string-052.html","https://www.ghmusic.com.au/guitars?limit=all"
"D'Addario LE053PB Phosphor Bronze Loop End Single String, .053","https://www.ghmusic.com.au/d-addario-le053pb-phosphor-bronze-loop-end-single-string-053.html","https://www.ghmusic.com.au/guitars?limit=all"
"D'Addario LE056W Nickel Wound Loop End Single String, .056","https://www.ghmusic.com.au/d-addario-le056w-nickel-wound-loop-end-single-string-056.html","https://www.ghmusic.com.au/guitars?limit=all"
"D'Addario LE059PB Phosphor Bronze Loop End Single String, .059","https://www.ghmusic.com.au/d-addario-le059pb-phosphor-bronze-loop-end-single-string-059.html","https://www.ghmusic.com.au/guitars?limit=all"
"D'Addario LE078PB Phosphor Bronze Loop End Single String, .078","https://www.ghmusic.com.au/d-addario-le078pb-phosphor-bronze-loop-end-single-string-078.html","https://www.ghmusic.com.au/guitars?limit=all"
"D'Addario LE092PB Phosphor Bronze Loop End Single String, .092","https://www.ghmusic.com.au/d-addario-le092pb-phosphor-bronze-loop-end-single-string-092.html","https://www.ghmusic.com.au/guitars?limit=all"
"D'Addario NYL019W Silver-plated Copper Classical Single String, .019 ","https://www.ghmusic.com.au/d-addario-nyl019w-silver-plated-copper-classical-single-string-019.html","https://www.ghmusic.com.au/guitars?limit=all"
"D'Addario NYL020 Rectified Nylon Classical Guitar Single String ,.020","https://www.ghmusic.com.au/d-addario-nyl020-rectified-nylon-classical-guitar-single-string-020.html","https://www.ghmusic.com.au/guitars?limit=all"
"D'Addario NYL022 Rectified Nylon Classical Guitar Single String ,.022","https://www.ghmusic.com.au/d-addario-nyl022-rectified-nylon-classical-guitar-single-string-022.html","https://www.ghmusic.com.au/guitars?limit=all"
"D'Addario NYL022W Silver-plated Copper Classical Single String, .022 ","https://www.ghmusic.com.au/d-addario-nyl022w-silver-plated-copper-classical-single-string-022.html","https://www.ghmusic.com.au/guitars?limit=all"
"D'Addario NYL025W Silver-plated Copper Classical Single String, .025 ","https://www.ghmusic.com.au/d-addario-nyl025w-silver-plated-copper-classical-single-string-025.html","https://www.ghmusic.com.au/guitars?limit=all"
"D'Addario NYL026W Silver-plated Copper Classical Single String, .026 ","https://www.ghmusic.com.au/d-addario-nyl026w-silver-plated-copper-classical-single-string-026.html","https://www.ghmusic.com.au/guitars?limit=all"
"D'Addario NYL028W Silver-plated Copper Classical Single String, .028 ","https://www.ghmusic.com.au/d-addario-nyl028w-silver-plated-copper-classical-single-string-028.html","https://www.ghmusic.com.au/guitars?limit=all"
"D'Addario NYL029 Rectified Nylon Classical Guitar Single String ,.029","https://www.ghmusic.com.au/d-addario-nyl029-rectified-nylon-classical-guitar-single-string-029.html","https://www.ghmusic.com.au/guitars?limit=all"
"D'Addario NYL030W Silver-plated Copper Classical Single String, .030 ","https://www.ghmusic.com.au/d-addario-nyl030w-silver-plated-copper-classical-single-string-030.html","https://www.ghmusic.com.au/guitars?limit=all"
"D'Addario NYL031 Rectified Nylon Classical Guitar Single String ,.031","https://www.ghmusic.com.au/d-addario-nyl031-rectified-nylon-classical-guitar-single-string-031.html","https://www.ghmusic.com.au/guitars?limit=all"
"D'Addario NYL033 Rectified Nylon Classical Guitar Single String ,.033","https://www.ghmusic.com.au/d-addario-nyl033-rectified-nylon-classical-guitar-single-string-033.html","https://www.ghmusic.com.au/guitars?limit=all"
"D'Addario NYL033W Silver-plated Copper Classical Single String, .033 ","https://www.ghmusic.com.au/d-addario-nyl033w-silver-plated-copper-classical-single-string-033.html","https://www.ghmusic.com.au/guitars?limit=all"
"D'Addario NYL035W Silver-plated Copper Classical Single String, .035 ","https://www.ghmusic.com.au/d-addario-nyl035w-silver-plated-copper-classical-single-string-035.html","https://www.ghmusic.com.au/guitars?limit=all"
"D'Addario NYL036W Silver-plated Copper Classical Single String, .036 ","https://www.ghmusic.com.au/d-addario-nyl036w-silver-plated-copper-classical-single-string-036.html","https://www.ghmusic.com.au/guitars?limit=all"
"D'Addario NYL040 Rectified Nylon Classical Guitar Single String ,.040","https://www.ghmusic.com.au/d-addario-nyl040-rectified-nylon-classical-guitar-single-string-040.html","https://www.ghmusic.com.au/guitars?limit=all"
"D'Addario NYL040W Silver-plated Copper Classical Single String, .040 ","https://www.ghmusic.com.au/d-addario-nyl040w-silver-plated-copper-classical-single-string-040.html","https://www.ghmusic.com.au/guitars?limit=all"
"D'Addario NYL045W Silver-plated Copper Classical Single String, .045 ","https://www.ghmusic.com.au/d-addario-nyl045w-silver-plated-copper-classical-single-string-045.html","https://www.ghmusic.com.au/guitars?limit=all"
"D'Addario NYL048W Silver-plated Copper Classical Single String, .048 ","https://www.ghmusic.com.au/d-addario-nyl048w-silver-plated-copper-classical-single-string-048.html","https://www.ghmusic.com.au/guitars?limit=all"
"D'Addario NYL054W Silver-plated Copper Classical Single String, .054 ","https://www.ghmusic.com.au/d-addario-nyl054w-silver-plated-copper-classical-single-string-054.html","https://www.ghmusic.com.au/guitars?limit=all"
"D'Addario NYL056W Silver-plated Copper Classical Single String, .056 ","https://www.ghmusic.com.au/d-addario-nyl056w-silver-plated-copper-classical-single-string-056.html","https://www.ghmusic.com.au/guitars?limit=all"
"D'Addario PB017 Phosphor Bronze Wound Acoustic Guitar Single String, .017","https://www.ghmusic.com.au/d-addario-pb017-phosphor-bronze-wound-acoustic-guitar-single-string-017.html","https://www.ghmusic.com.au/guitars?limit=all"
"D'Addario PB020 Phosphor Bronze Wound Acoustic Guitar Single String, .020","https://www.ghmusic.com.au/d-addario-pb020-phosphor-bronze-wound-acoustic-guitar-single-string-020.html","https://www.ghmusic.com.au/guitars?limit=all"
"D'Addario PB023 Phosphor Bronze Wound Acoustic Guitar Single String, .023","https://www.ghmusic.com.au/d-addario-pb023-phosphor-bronze-wound-acoustic-guitar-single-string-023.html","https://www.ghmusic.com.au/guitars?limit=all"
"D'Addario PB024 Phosphor Bronze Wound Acoustic Guitar Single String, .024","https://www.ghmusic.com.au/d-addario-pb024-phosphor-bronze-wound-acoustic-guitar-single-string-024.html","https://www.ghmusic.com.au/guitars?limit=all"
"D'Addario PB027 Phosphor Bronze Wound Acoustic Guitar Single String, .027","https://www.ghmusic.com.au/d-addario-pb027-phosphor-bronze-wound-acoustic-guitar-single-string-027.html","https://www.ghmusic.com.au/guitars?limit=all"
"D'Addario PB028 Phosphor Bronze Wound Acoustic Guitar Single String, .028","https://www.ghmusic.com.au/d-addario-pb028-phosphor-bronze-wound-acoustic-guitar-single-string-028.html","https://www.ghmusic.com.au/guitars?limit=all"
"D'Addario PB030 Phosphor Bronze Wound Acoustic Guitar Single String, .032","https://www.ghmusic.com.au/d-addario-pb030-phosphor-bronze-wound-acoustic-guitar-single-string-032.html","https://www.ghmusic.com.au/guitars?limit=all"
"D'Addario PB030 Phosphor Bronze Wound Acoustic Guitar Single String, .034","https://www.ghmusic.com.au/d-addario-pb030-phosphor-bronze-wound-acoustic-guitar-single-string-034.html","https://www.ghmusic.com.au/guitars?limit=all"
