"product_name","product_link","category_link"
"Valencia TC3K 3/4 Size Classical Guitar Pack With Bag And DVD","https://www.ghmusic.com.au/valencia-tc3k.html","https://www.ghmusic.com.au/guitars?limit=all"
"Valencia TC4K 4/4 Size Classical Guitar Pack With Bag And DVD","https://www.ghmusic.com.au/valencia-tc4k.html","https://www.ghmusic.com.au/guitars?limit=all"
"Maton ""Mini Maton"" Acoustic/Electric Guitar","https://www.ghmusic.com.au/maton-mini-maton-acoustic-electric-guitar.html","https://www.ghmusic.com.au/guitars?limit=all"
"Mesa Boogie Tone Burst Pedal","https://www.ghmusic.com.au/mesa-boogie-tone-burst-pedal.html","https://www.ghmusic.com.au/guitars?limit=all"
"TC Electronic Flashback delay Pedal","https://www.ghmusic.com.au/flashback-delay.html","https://www.ghmusic.com.au/guitars?limit=all"
"Tc Electronic MojoMojo Overdrive Pedal","https://www.ghmusic.com.au/mojo-mojo-overdrive.html","https://www.ghmusic.com.au/guitars?limit=all"
"D'Addario EXP10 Coated Acoustic Guitar Strings, 80/20, Extra Light, 10-47","https://www.ghmusic.com.au/d-addario-exp10-coated-acoustic-guitar-strings-80-20-extra-light-10-47.html","https://www.ghmusic.com.au/guitars?limit=all"
"Mono M80 Guitar Tick","https://www.ghmusic.com.au/mono-m80-guitar-tick.html","https://www.ghmusic.com.au/guitars?limit=all"
"Dunlop Phosphor Bronze Acoutic Strings Medium Light 11-52","https://www.ghmusic.com.au/dunlop-phosphor-bronze-acoutic-strings-medium-light-11-52.html","https://www.ghmusic.com.au/guitars?limit=all"
"IBANEZ AS53 Trans Black Guitar","https://www.ghmusic.com.au/as53-trans-black.html","https://www.ghmusic.com.au/guitars?limit=all"
"D'Addario EXP26 Coated Phosphor Bronze Acoustic Guitar Strings, Custom Light, 11-52","https://www.ghmusic.com.au/d-addario-exp26-coated-phosphor-bronze-custom-light-11-52.html","https://www.ghmusic.com.au/guitars?limit=all"
"D'Addario EXP16 Coated Phosphor Bronze Acoustic Guitar Strings, Light, 12-53","https://www.ghmusic.com.au/d-addario-exp16-coated-phosphor-bronze-light-12-53.html","https://www.ghmusic.com.au/guitars?limit=all"
"D'Addario EXP110 Coated Electric Guitar Strings, Light, 10-46","https://www.ghmusic.com.au/d-addario-exp110-coated-nickel-wound-light-10-46.html","https://www.ghmusic.com.au/guitars?limit=all"
"D'Addario EJ15 Phosphor Bronze Acoustic Guitar Strings, Extra Light, 10-47","https://www.ghmusic.com.au/d-addario-ej15-phosphor-bronze-extra-light-10-47.html","https://www.ghmusic.com.au/guitars?limit=all"
"D'Addario EJ17 Phosphor Bronze Acoustic Guitar Strings, Medium, 13-56","https://www.ghmusic.com.au/d-addario-ej17-phosphor-bronze-medium-13-56.html","https://www.ghmusic.com.au/guitars?limit=all"
"KORG EXP-2 EXPRESSION PEDAL","https://www.ghmusic.com.au/korg-exp-2-expression-pedal.html","https://www.ghmusic.com.au/guitars?limit=all"
"D'Addario EJ45C Pro-Arte Composite Classical Guitar Strings, Normal Tension","https://www.ghmusic.com.au/d-addario-ej45c-pro-arte-composite-normal-tension.html","https://www.ghmusic.com.au/guitars?limit=all"
"D'Addario EXP45 Coated Classical Guitar Strings, Normal Tension","https://www.ghmusic.com.au/d-addario-exp45-coated-normal-tension.html","https://www.ghmusic.com.au/guitars?limit=all"
"D'Addario EJ21 Nickel Wound Electric Guitar Strings, Jazz Light, 12-52","https://www.ghmusic.com.au/d-addario-ej21-nickel-wound-jazz-light-12-52.html","https://www.ghmusic.com.au/guitars?limit=all"
"D'Addario EJ22 Nickel Wound Electric Guitar Strings, Jazz Medium, 13-56","https://www.ghmusic.com.au/d-addario-ej22-nickel-wound-jazz-medium-13-56.html","https://www.ghmusic.com.au/guitars?limit=all"
"D'Addario EXL120-3D Nickel Wound Electric Guitar Strings, Super Light, 9-42, 3 Sets","https://www.ghmusic.com.au/d-addario-exl120-3d-nickel-wound-super-light-9-42.html","https://www.ghmusic.com.au/guitars?limit=all"
"D'Addario EXL110-3D Nickel Wound Electric Guitar Strings, Regular Light, 10-46, 3 Sets","https://www.ghmusic.com.au/d-addario-exl110-3d-nickel-wound-regular-light-10-46.html","https://www.ghmusic.com.au/guitars?limit=all"
"D'Addario EJ26-3D Phosphor Bronze Acoustic Guitar Strings, Custom Light, 11-52, 3 Sets","https://www.ghmusic.com.au/d-addario-ej26-3d-phosphor-bronze-custom-light-11-52.html","https://www.ghmusic.com.au/guitars?limit=all"
"D'Addario EJ16-3D Phosphor Bronze Acoustic Guitar Strings, Light, 3 Sets","https://www.ghmusic.com.au/d-addario-ej16-3d-phosphor-bronze-light-12-53.html","https://www.ghmusic.com.au/guitars?limit=all"
"GRETSCH G5435 Electromatic Pro Jet Guitar","https://www.ghmusic.com.au/g5435-pro-jet.html","https://www.ghmusic.com.au/guitars?limit=all"
"GRETSCH G5435T Electromatic Guitar","https://www.ghmusic.com.au/g5435t-electromatic.html","https://www.ghmusic.com.au/guitars?limit=all"
"D'Addario EXL130 Nickel Wound Electric Guitar Strings, Extra-Super Light, 8-38","https://www.ghmusic.com.au/d-addario-exl130-nickel-wound-extra-super-light-8-38.html","https://www.ghmusic.com.au/guitars?limit=all"
"D'Addario EXL120 Nickel Wound Electric Guitar Strings, Super Light, 9-42","https://www.ghmusic.com.au/d-addario-exl120-nickel-wound-super-light-9-42.html","https://www.ghmusic.com.au/guitars?limit=all"
"D'Addario EXL115 Nickel Wound Electric Guitar Strings, Medium/Blues-Jazz Rock, 11-49","https://www.ghmusic.com.au/d-addario-exl115-nickel-wound-medium-blues-jazz-rock-11-49.html","https://www.ghmusic.com.au/guitars?limit=all"
"D'Addario EJ26-10P Phosphor Bronze Acoustic Guitar Strings, Custom Light, 11-52, 10 Sets","https://www.ghmusic.com.au/d-addario-ej26-10p-phosphor-bronze-custom-light-11-52.html","https://www.ghmusic.com.au/guitars?limit=all"
"Jose Ramirez 130CD Classical Guitar","https://www.ghmusic.com.au/jose-ramirez-130cd.html","https://www.ghmusic.com.au/guitars?limit=all"
"Esteve 4ST Classical Guitar","https://www.ghmusic.com.au/esteve-4st.html","https://www.ghmusic.com.au/guitars?limit=all"
"Esteve Model 5 Classical Guitar","https://www.ghmusic.com.au/esteve-model-5.html","https://www.ghmusic.com.au/guitars?limit=all"
"Esteve Model 7 Classical Guitar","https://www.ghmusic.com.au/esteve-model-7.html","https://www.ghmusic.com.au/guitars?limit=all"
"Yamaha CG122MS Classical Guitar","https://www.ghmusic.com.au/yamaha-cg122ms.html","https://www.ghmusic.com.au/guitars?limit=all"
"Fender 70L 80/20 Bronze Acoustic Strings - Light ","https://www.ghmusic.com.au/fender-70l-80-20-bronze-acoustic-strings-light.html","https://www.ghmusic.com.au/guitars?limit=all"
"Fender 60L Phosphor Bronze Acoustic Strings - Light","https://www.ghmusic.com.au/fender-60l-phosphor-bronze-acoustic-strings-light.html","https://www.ghmusic.com.au/guitars?limit=all"
"Fender 3250L Nickel-Plated Steel Bullet-End Electric Guitar Strings - Light","https://www.ghmusic.com.au/fender-3250l-nickel-plated-steel-bullet-end-electric-guitar-strings-light.html","https://www.ghmusic.com.au/guitars?limit=all"
"Fender 250L Super 250 Nickel-Plated Steel Electric Guitar Strings - Light","https://www.ghmusic.com.au/fender-250l-super-250-nickel-plated-steel-electric-guitar-strings-light.html","https://www.ghmusic.com.au/guitars?limit=all"
"Squier Affinity Fat Strat HSS Guitar","https://www.ghmusic.com.au/affinity-fat-strat-hhs.html","https://www.ghmusic.com.au/guitars?limit=all"
"Squier Bullet Strat ""Arctic White"" Guitar","https://www.ghmusic.com.au/bullet-strat-arctic-white.html","https://www.ghmusic.com.au/guitars?limit=all"
"Squier Bullet Strat ""Black"" Guitar","https://www.ghmusic.com.au/bullet-strat-black.html","https://www.ghmusic.com.au/guitars?limit=all"
"Squier Standard Telecaster  ""Vintage Blonde"" Guitar","https://www.ghmusic.com.au/standard-telecaster-vintage-blonde.html","https://www.ghmusic.com.au/guitars?limit=all"
"Squier Vintage Modified Mustang ""Vintage White"" Guitar","https://www.ghmusic.com.au/vintage-modified-mustang-vintage-white.html","https://www.ghmusic.com.au/guitars?limit=all"
"Squier Vintage Modified Deluxe ""Black"" Guitar","https://www.ghmusic.com.au/vintage-modified-deluxe-black.html","https://www.ghmusic.com.au/guitars?limit=all"
"Fender FM-100 Mandolin Pack","https://www.ghmusic.com.au/fender-fm-100-mandolin-pack.html","https://www.ghmusic.com.au/guitars?limit=all"
"Gretsch G9200 Boxcar Round-Neck Resonator","https://www.ghmusic.com.au/gretsch-g9200-boxcar-round-neck-resonator.html","https://www.ghmusic.com.au/guitars?limit=all"
"Gretsch G9201 Honey Dipper Round-Neck Resonator","https://www.ghmusic.com.au/gretsch-g9201-honey-dipper-round-neck-resonator.html","https://www.ghmusic.com.au/guitars?limit=all"
"Mahalo MR1GN Ukelele","https://www.ghmusic.com.au/mahalo-u30g-ukelele.html","https://www.ghmusic.com.au/guitars?limit=all"
"Mahalo MR1LBU Ukelele","https://www.ghmusic.com.au/mahalo-u30lb-ukelele.html","https://www.ghmusic.com.au/guitars?limit=all"
"Mahalo MR1RD Ukelele","https://www.ghmusic.com.au/mahalo-u30-ukelele.html","https://www.ghmusic.com.au/guitars?limit=all"
"Mahalo MR1WT Ukelele","https://www.ghmusic.com.au/mahalo-u30w-ukelele.html","https://www.ghmusic.com.au/guitars?limit=all"
"Gretsch G9450 Dixie Banjo","https://www.ghmusic.com.au/gretsch-g9450-dixie-banjo.html","https://www.ghmusic.com.au/guitars?limit=all"
"Planet Waves NS Capo Lite","https://www.ghmusic.com.au/planet-waves-ns-capo-lite.html","https://www.ghmusic.com.au/guitars?limit=all"
"Dunlop Glass Slide Regular 202","https://www.ghmusic.com.au/dunlop-glass-slide-regular-202.html","https://www.ghmusic.com.au/guitars?limit=all"
"Dunlop Glass Slide Heavy 212","https://www.ghmusic.com.au/dunlop-glass-slide-heavy-212.html","https://www.ghmusic.com.au/guitars?limit=all"
"Dunlop Brass Slide 224","https://www.ghmusic.com.au/dunlop-brass-slide-224.html","https://www.ghmusic.com.au/guitars?limit=all"
"Dunlop Joe Perry Boneyard Slide 256","https://www.ghmusic.com.au/dunlop-joe-perry-boneyard-slide-256.html","https://www.ghmusic.com.au/guitars?limit=all"
"Planet Waves Screeching Halt Acoustic Soundhole Cover","https://www.ghmusic.com.au/planet-waves-screeching-halt.html","https://www.ghmusic.com.au/guitars?limit=all"
"Squier Affinity Telecaster Pack ""Sunburst""","https://www.ghmusic.com.au/squier-affinity-telecaster-pack-sunburst.html","https://www.ghmusic.com.au/guitars?limit=all"
"Squier Affinity Strat HSS Pack ""Sunburst""","https://www.ghmusic.com.au/squier-affinity-strat-hss-pack-sunburst.html","https://www.ghmusic.com.au/guitars?limit=all"
"FENDER PERFORMANCE SERIES INSTRUMENT CABLES 10Ft","https://www.ghmusic.com.au/fender-performance-series-instrument-cables-10ft.html","https://www.ghmusic.com.au/guitars?limit=all"
"FENDER PERFORMANCE SERIES INSTRUMENT CABLES 18FT Right Angle","https://www.ghmusic.com.au/fender-performance-series-instrument-cables-18ft-right-angle.html","https://www.ghmusic.com.au/guitars?limit=all"
"FENDER CUSTOM SHOP PERFORMANCE SERIES CABLES TWEED 10FT ANGLE","https://www.ghmusic.com.au/fender-custom-shop-performance-series-cables-tweed-10ft-angle.html","https://www.ghmusic.com.au/guitars?limit=all"
"Line 6 DL4 Delay Modeler","https://www.ghmusic.com.au/line-6-dl4.html","https://www.ghmusic.com.au/guitars?limit=all"
"Martin DRS2 Dreadnought Acoustic Electric Guitar","https://www.ghmusic.com.au/martin-drs2.html","https://www.ghmusic.com.au/guitars?limit=all"
"Martin OM-21 Acoustic Guitar","https://www.ghmusic.com.au/martin-om-21.html","https://www.ghmusic.com.au/guitars?limit=all"
"Martin D-18 Dreadnought Guitar","https://www.ghmusic.com.au/martin-d-18.html","https://www.ghmusic.com.au/guitars?limit=all"
"Boss TR-2 Tremolo Pedal","https://www.ghmusic.com.au/boss-tr-2-tremolo.html","https://www.ghmusic.com.au/guitars?limit=all"
"Roland EV-5 Expression Pedal","https://www.ghmusic.com.au/roland-ev-5-7-expression-pedals.html","https://www.ghmusic.com.au/guitars?limit=all"
"Roland GA-FC GA Foot Controller","https://www.ghmusic.com.au/roland-ga-fc-ga-foot-controller.html","https://www.ghmusic.com.au/guitars?limit=all"
"Fender CD-60CE Mahogany Acoustic Electric Guitar","https://www.ghmusic.com.au/fender-cd-60ce-all-mahogany.html","https://www.ghmusic.com.au/guitars?limit=all"
"Fender CD-60 All Mahogany Acoustic Guitar","https://www.ghmusic.com.au/fender-cd-60-all-mahogany.html","https://www.ghmusic.com.au/guitars?limit=all"
"Fender CF-140SCE Acoustic Electric Guitar","https://www.ghmusic.com.au/fender-cf-140sce.html","https://www.ghmusic.com.au/guitars?limit=all"
"DR Strings Tite-Fit MT-10 Medium-Tite Nickel Plated Electric Guitar Strings","https://www.ghmusic.com.au/dr-strings-tite-fit-mt-10-medium-tite-nickel-plated-electric-guitar-strings.html","https://www.ghmusic.com.au/guitars?limit=all"
"DR Strings RPML-11 RARE Phosphor Bronze Acoustic Guitar Strings ","https://www.ghmusic.com.au/dr-strings-rpml-11-rare-phosphor-bronze-acoustic-guitar-strings.html","https://www.ghmusic.com.au/guitars?limit=all"
"Ashton SPD25NTM Guitar Pack Natural","https://www.ghmusic.com.au/ashton-spd25ntm-guitar-pack-natural.html","https://www.ghmusic.com.au/guitars?limit=all"
"Ashton SPD25CEQ Acoustic Electric Guitar Pack Natural (Left Handed)","https://www.ghmusic.com.au/ashton-spd25ceq-acoustic-electric-guitar-pack-natural-left-handed.html","https://www.ghmusic.com.au/guitars?limit=all"
"DiMarzio DP155B ""The Tone Zone"" Pick-up","https://www.ghmusic.com.au/dimarzio-the-tone-zone.html","https://www.ghmusic.com.au/guitars?limit=all"
"DiMarzio DP130 Acoustic Model Pick-up","https://www.ghmusic.com.au/dimarzio-acoustic-model.html","https://www.ghmusic.com.au/guitars?limit=all"
"Seymour Duncan Hot Rodded Humbucker Set","https://www.ghmusic.com.au/seymour-duncan-hot-rodded-humbucker-set.html","https://www.ghmusic.com.au/guitars?limit=all"
"Seymour Duncan SET-VB Vintage Blues Humbucker Set","https://www.ghmusic.com.au/seymour-duncan-vintage-blues-humbucker-set.html","https://www.ghmusic.com.au/guitars?limit=all"
"Seymour Duncan SL59-1BW Little '59 for Strat","https://www.ghmusic.com.au/seymour-duncan-little-59-for-strat.html","https://www.ghmusic.com.au/guitars?limit=all"
"Seymour Duncan SJBJ-1BW JB Jr. for Strat","https://www.ghmusic.com.au/seymour-duncan-jb-jr-for-strat.html","https://www.ghmusic.com.au/guitars?limit=all"
"Seymour Duncan STL-3 Quarter Pound for Tele (Bridge)","https://www.ghmusic.com.au/seymour-duncan-quarter-pound-for-tele-bridge.html","https://www.ghmusic.com.au/guitars?limit=all"
"Seymour Duncan APH-1NNC Alnico II Pro Humbucker","https://www.ghmusic.com.au/seymour-duncan-alnico-ii-pro-humbucker.html","https://www.ghmusic.com.au/guitars?limit=all"
"Fender Classic Series 1972 Telecaster Deluxe ""Black"" Guitar","https://www.ghmusic.com.au/classic-series-1972-telecaster-deluxe-black.html","https://www.ghmusic.com.au/guitars?limit=all"
"Fender Classic Series 1972 Thinline ""Natural"" Guitar","https://www.ghmusic.com.au/classic-series-1972-thinline-natural.html","https://www.ghmusic.com.au/guitars?limit=all"
"Fender Eric Claptop 'Blackie' Stratocaster SSS Guitar","https://www.ghmusic.com.au/eric-claptop-blackie-stratocaster-sss.html","https://www.ghmusic.com.au/guitars?limit=all"
"Fender Classic Player Jazzmaster ""Black"" Guitar","https://www.ghmusic.com.au/classic-player-jazzmaster-black.html","https://www.ghmusic.com.au/guitars?limit=all"
"Fender Standard  ""Black"" Telecaster Guitar","https://www.ghmusic.com.au/standard-telecaster-black.html","https://www.ghmusic.com.au/guitars?limit=all"
"Martin 0XK Ukelele","https://www.ghmusic.com.au/martin-0xk-ukelele.html","https://www.ghmusic.com.au/guitars?limit=all"
"Cole Clark Fl1E 12 String Acoustic Electric Guitar","https://www.ghmusic.com.au/cole-clark-fl1a-12-string.html","https://www.ghmusic.com.au/guitars?limit=all"
"Cole Clark Angel 2EC Rosewood Acoustic Electric Guitar","https://www.ghmusic.com.au/cole-clark-angel-2ac-rosewood.html","https://www.ghmusic.com.au/guitars?limit=all"
"Crafter DE 6/N Acoustic Electric Guitar","https://www.ghmusic.com.au/crafter-de-6-n.html","https://www.ghmusic.com.au/guitars?limit=all"
"Crafter DE 7/N Acoustic Electric Guitar","https://www.ghmusic.com.au/crafter-de-7-n.html","https://www.ghmusic.com.au/guitars?limit=all"
"Crafter GAE650TM Acoustic Electric Guitar","https://www.ghmusic.com.au/crafter-gae650tm.html","https://www.ghmusic.com.au/guitars?limit=all"
"Crafter HILITE TE VINTAGE Acoustic Electric Guitar ","https://www.ghmusic.com.au/crafter-hilite-te-vtg.html","https://www.ghmusic.com.au/guitars?limit=all"
"HOSA TECHNOLOGY 6"" GUITAR PEDAL CABLE - METAL RIGHT ANGLE PLUGS ","https://www.ghmusic.com.au/hosa-technology-06-inch-pedal-cable-metal-ra.html","https://www.ghmusic.com.au/guitars?limit=all"
"HOSA TECHNOLOGY 12"" PEDAL CABLE - METAL RIGHT ANGLE PLUGS","https://www.ghmusic.com.au/hosa-technology-12-inch-pedal-cable-metal-ra.html","https://www.ghmusic.com.au/guitars?limit=all"
"Stagg SG-A0081BK A Frame Acoustic/Electric Guitar Stand","https://www.ghmusic.com.au/stagg-sg-a0081bk-a-frame-acoustic-electric-guitar-stand-black.html","https://www.ghmusic.com.au/guitars?limit=all"
"Fender Multi-Stand 3 Guitar Stand","https://www.ghmusic.com.au/fender-multi-stand-3-guitar-stand.html","https://www.ghmusic.com.au/guitars?limit=all"
"KONIG & MEYER Memphis 10 Guitar Stand","https://www.ghmusic.com.au/konig-meyer-memphis-10-guitar-stand.html","https://www.ghmusic.com.au/guitars?limit=all"
"Xtreme Multi Guitar Stand (3)","https://www.ghmusic.com.au/xtreme-multi-guitar-stand-3.html","https://www.ghmusic.com.au/guitars?limit=all"
"Fender Universal A Frame Electric Guitar Stand","https://www.ghmusic.com.au/fender-universal-a-frame-electric-guitar-stand.html","https://www.ghmusic.com.au/guitars?limit=all"
"Ashton FS100 Footstool","https://www.ghmusic.com.au/ashton-fs100-footstool.html","https://www.ghmusic.com.au/guitars?limit=all"
"Electro-Harmonix Micro POG Pedal","https://www.ghmusic.com.au/electro-harmonix-micro-pog.html","https://www.ghmusic.com.au/guitars?limit=all"
"Electro-Harmonix POG 2 Pedal","https://www.ghmusic.com.au/electro-harmonix-pog-2.html","https://www.ghmusic.com.au/guitars?limit=all"
"Way Huge WHE701 Aqua Puss Pedal","https://www.ghmusic.com.au/way-huge-whe701-aqua-puss.html","https://www.ghmusic.com.au/guitars?limit=all"
"MXR M75 Super Badass Distortion Pedal","https://www.ghmusic.com.au/mxr-m75-super-badass-distortion.html","https://www.ghmusic.com.au/guitars?limit=all"
"MXR Micro Chorus Pedal","https://www.ghmusic.com.au/mxr-micro-chorus.html","https://www.ghmusic.com.au/guitars?limit=all"
"MXR Smart Gate Noise Gate Pedal","https://www.ghmusic.com.au/mxr-smart-gate-noise-gate.html","https://www.ghmusic.com.au/guitars?limit=all"
"MXR Carbon Copy Pedal","https://www.ghmusic.com.au/mxr-carbon-copy.html","https://www.ghmusic.com.au/guitars?limit=all"
"MXR Custom Audio Electronics Boost Linedriver Pedal","https://www.ghmusic.com.au/mxr-custom-audio-electronics-boost-linedriver.html","https://www.ghmusic.com.au/guitars?limit=all"
"MXR Fullbore Metal Pedal","https://www.ghmusic.com.au/mxr-fullbore-metal.html","https://www.ghmusic.com.au/guitars?limit=all"
"MXR Custom Badass 78 Distortion Pedal","https://www.ghmusic.com.au/mxr-custom-badass-78-distortion.html","https://www.ghmusic.com.au/guitars?limit=all"
"Yamaha Pacifica PAC012DBM Dark Blue Metallic Guitar","https://www.ghmusic.com.au/yamaha-pacifica-012-dark-blue-metallic.html","https://www.ghmusic.com.au/guitars?limit=all"
"Yamaha Pacifica 012 Red Metallic Guitar","https://www.ghmusic.com.au/yamaha-pacifica-012-red-metallic.html","https://www.ghmusic.com.au/guitars?limit=all"
"Ernie Ball Red Polypro Guitar Strap","https://www.ghmusic.com.au/ernie-ball-red-polypro-strap.html","https://www.ghmusic.com.au/guitars?limit=all"
"Ernie Ball Rainbow Polypro Guitar Strap","https://www.ghmusic.com.au/ernie-ball-rainbow-polypro-strap.html","https://www.ghmusic.com.au/guitars?limit=all"
"Ernie Ball Burgundy Polypro Guitar Strap","https://www.ghmusic.com.au/ernie-ball-burgundy-polypro-strap.html","https://www.ghmusic.com.au/guitars?limit=all"
"Ernie Ball Olive Polypro Guitar Strap","https://www.ghmusic.com.au/ernie-ball-olive-polypro-strap.html","https://www.ghmusic.com.au/guitars?limit=all"
"Ernie Ball Brown Polypro Guitar Strap","https://www.ghmusic.com.au/ernie-ball-brown-polypro-strap.html","https://www.ghmusic.com.au/guitars?limit=all"
"Dunlop Double D Black Guitar Strap","https://www.ghmusic.com.au/dunlop-double-d-black-strap.html","https://www.ghmusic.com.au/guitars?limit=all"
"Planet Waves Planet Lock Guitar Strap, Black","https://www.ghmusic.com.au/planet-waves-planet-lock-guitar-strap.html","https://www.ghmusic.com.au/guitars?limit=all"
"Fender Vintage Leather Guitar Strap","https://www.ghmusic.com.au/fender-vintage-leather-strap.html","https://www.ghmusic.com.au/guitars?limit=all"
"Fender Monogrammed Guitar Strap","https://www.ghmusic.com.au/fender-monogrammed-strap-4222.html","https://www.ghmusic.com.au/guitars?limit=all"
"Fender Monogrammed Guitar Strap","https://www.ghmusic.com.au/fender-monogrammed-strap.html","https://www.ghmusic.com.au/guitars?limit=all"
"TC HELICON VoiceTone Harmony-G XT HARMONY PEDAL FOR GUITARISTS","https://www.ghmusic.com.au/tc-helicon-voicetone-harmony-g-xt-harmony-pedal-for-guitarists.html","https://www.ghmusic.com.au/guitars?limit=all"
"Music Man Luke III HH Electric Guitar","https://www.ghmusic.com.au/music-man-luke-iii-hh-electric-guitar.html","https://www.ghmusic.com.au/guitars?limit=all"
"Cry Baby CB95 Wah Wah Pedal","https://www.ghmusic.com.au/cry-baby-wah-wah-pedal.html","https://www.ghmusic.com.au/guitars?limit=all"
"Cry Baby 535Q Multi Wah Pedal","https://www.ghmusic.com.au/cry-baby-535q-multi-wah-pedal.html","https://www.ghmusic.com.au/guitars?limit=all"
"Vox V845 Wah Pedal","https://www.ghmusic.com.au/vox-v845-wah-pedal.html","https://www.ghmusic.com.au/guitars?limit=all"
"Martin SP Custom Light Phosphor Bronze Guitar Strings","https://www.ghmusic.com.au/martin-sp-custom-light-phosphor-bronze-guitar-strings.html","https://www.ghmusic.com.au/guitars?limit=all"
"Martin SP LIFESPAN Custom Light Phosphor Bronze Guitar Strings","https://www.ghmusic.com.au/martin-sp-lifespan-custom-light-phosphor-bronze-guitar-strings.html","https://www.ghmusic.com.au/guitars?limit=all"
"Martin SP LIFESPAN Light Phosphor Bronze Guitar Strings","https://www.ghmusic.com.au/martin-sp-lifespan-light-phosphor-bronze-guitar-strings.html","https://www.ghmusic.com.au/guitars?limit=all"
"Martin FX Light Phosphor Bronze Guitar Strings","https://www.ghmusic.com.au/martin-fx-light-phosphor-bronze-guitar-strings.html","https://www.ghmusic.com.au/guitars?limit=all"
"Martin Silk & Steel Folk Guitar Strings","https://www.ghmusic.com.au/martin-silk-steel-folk-guitar-strings.html","https://www.ghmusic.com.au/guitars?limit=all"
"GHS Boomers GBM Electrics 11-50","https://www.ghmusic.com.au/ghs-boomers-gbm-electrics-11-50.html","https://www.ghmusic.com.au/guitars?limit=all"
"GHS Phosphor Bronze Acoustic Guitar Strings Extra Light","https://www.ghmusic.com.au/ghs-phosphor-bronze-acoustic-guitar-strings-extra-light.html","https://www.ghmusic.com.au/guitars?limit=all"
"Elixir Electric Custom Light 9-42 Electric Guitar Strings","https://www.ghmusic.com.au/elixir-electric-custom-light-9-42-electric-guitar-strings.html","https://www.ghmusic.com.au/guitars?limit=all"
"Elixir Electric Light 10-46 Electric Guitar Strings","https://www.ghmusic.com.au/elixir-electric-light-10-46-electric-guitar-strings.html","https://www.ghmusic.com.au/guitars?limit=all"
"Elixir Acoustic  Medium 13-56 Acoustic Guitar Strings","https://www.ghmusic.com.au/elixir-acoustic-medium-13-56-acoustic-guitar-strings.html","https://www.ghmusic.com.au/guitars?limit=all"
"Elixir 12 String Acoustic  Light 10-47 Guitar Strings","https://www.ghmusic.com.au/elixir-12-string-acoustic-light-10-47-guitar-strings.html","https://www.ghmusic.com.au/guitars?limit=all"
"Yamaha Gigmaker10 Electric Guitar Pack","https://www.ghmusic.com.au/yamaha-gigmaker10-electric-guitar-pack.html","https://www.ghmusic.com.au/guitars?limit=all"
"Yamaha GIGMAKERC40 Classical Guitar Pack","https://www.ghmusic.com.au/yamaha-gigmakerc40-classical-guitar-pack.html","https://www.ghmusic.com.au/guitars?limit=all"
"Vox Lil' Looper Effect Pedal","https://www.ghmusic.com.au/vox-lil-looper-effect-pedal.html","https://www.ghmusic.com.au/guitars?limit=all"
"ESP LTD H-351NT See Thru Black Cherry Guitar","https://www.ghmusic.com.au/ltd-h-351nt-see-thru-black-cherry.html","https://www.ghmusic.com.au/guitars?limit=all"
"Squier Affinity Strat Pack ""Black"" With FM10G Amp","https://www.ghmusic.com.au/squier-affinity-strat-pack-black-with-fm10g-amp.html","https://www.ghmusic.com.au/guitars?limit=all"
"Squier Affinity Strat Pack ""Sunburst"" With FM10G Amp","https://www.ghmusic.com.au/squier-affinity-strat-pack-sunburst-with-fm10g-amp.html","https://www.ghmusic.com.au/guitars?limit=all"
"Fender Standard Telecaster MN Sunburst Guitar","https://www.ghmusic.com.au/fender-standard-telecaster-mn-sunburst.html","https://www.ghmusic.com.au/guitars?limit=all"
"Fender Standard Telecaster MN Sunburst Left-Handed Guitar","https://www.ghmusic.com.au/fender-standard-telecaster-mn-sunburst-left-handed.html","https://www.ghmusic.com.au/guitars?limit=all"
"Martin OM-28E Retro Guitar","https://www.ghmusic.com.au/martin-om-28e-retro.html","https://www.ghmusic.com.au/guitars?limit=all"
"Ibanez RX70QA Trans Black Sunburst Guitar","https://www.ghmusic.com.au/ibanez-rx70qa-trans-black-sunburst.html","https://www.ghmusic.com.au/guitars?limit=all"
"Line 6 POD HD 500X","https://www.ghmusic.com.au/line-6-pod-hd-500x.html","https://www.ghmusic.com.au/guitars?limit=all"
"Fishman Triple Play","https://www.ghmusic.com.au/fishman-triple-play.html","https://www.ghmusic.com.au/guitars?limit=all"
"Squier Affinity Stratocaster Left-Handed Guitar","https://www.ghmusic.com.au/fender-squier-affinity-stratocaster-left-handed.html","https://www.ghmusic.com.au/guitars?limit=all"
"Fender Squier Deluxe Hot Rails Strat Black Guitar","https://www.ghmusic.com.au/fender-squier-deluxe-hot-rails-strat-black.html","https://www.ghmusic.com.au/guitars?limit=all"
